"key","source","context","af","ar","bn","zh-CN","zh-TW","cs","nl","en","et","fr","de","el","he","hi","hu","id","it","ja","ko","no","fa","pl","pt-PT","ru","es-ES","sv-SE","tr","uk","vi"
"TR_ENTER_PIN","Enter PIN","Button. Submit PIN","","","","","","","","","","","","","","","","","","","","","","","","","","","","",""
"TR_PIN_MANUAL_LINK","Learn more","Link to PIN manual","","","","","","","","","","","","","","","","","","","","","","","","","","","","",""
"TR_NOT_SURE_HOW_PIN_WORKS","Not sure how PIN works? {TR_PIN_MANUAL_LINK}","Link to PIN manual","","","","","","","","","","","","","","","","","","","","","","","","","","","","",""
"TR_DEVICE_YOU_RECONNECTED_IS_DIFFERENT","Device you reconnected is different from the previous device. Connect the right one or refresh your internet browser and start again.","Text that indicates that user reconnected different device than he was working with before","","","","","","","","","","","","","","","","","","","","","","","","","","","","",""
"TR_CONNECTED_DEVICE_IS_IN_BOOTLOADER","Connected device is in bootloader mode. Reconnect it to continue.","Text that indicates that user connected device in bootloader mode","","","","","","","","","","","","","","","","","","","","","","","","","","","","",""
"TR_DEVICE_IS_USED_IN_OTHER_WINDOW_HEADING","Device is used in other window","","","","","","","","","","","","","","","","","","","","","","","","","","","","","",""
"TR_DEVICE_IS_USED_IN_OTHER_WINDOW_TEXT","This is a big no no. Please dont use device in other window. Close all other windows or tabs that might be using your Trezor device.","","","","","","","","","","","","","","","","","","","","","","","","","","","","","",""
"TR_DEVICE_IS_USED_IN_OTHER_WINDOW_BUTTON","Continue","","","","","","","","","","","","","","","","","","","","","","","","","","","","","",""
"TR_ENTER_PIN_HEADING","Enter PIN","","","","","","","","","","","","","","","","","","","","","","","","","","","","","",""
"TR_ENTER_PIN_TEXT","Your device gets locked anytime you disconnect it. You now need to enter your PIN to continue.","","","","","","","","","","","","","","","","","","","","","","","","","","","","","",""
"TR_RECONNECT_HEADER","Reconnect your device","","","","","","","","","","","","","","","","","","","","","","","","","","","","","",""
"TR_RECONNECT_TEXT","We lost connection with your device. This might mean:","","","","","","","","","","","","","","","","","","","","","","","","","","","","","",""
"TR_RECONNECT_TROUBLESHOOT_CABEL","Cable is broken, try another one","","","","","","","","","","","","","","","","","","","","","","","","","","","","","",""
"TR_RECONNECT_TROUBLESHOOT_CONNECTION","Device is not well connected to the cable","","","","","","","","","","","","","","","","","","","","","","","","","","","","","",""
"TR_RECONNECT_TROUBLESHOOT_BRIDGE","Trezor bridge might have stopped working, try restarting","","","","","","","","","","","","","","","","","","","","","","","","","","","","","",""
"TR_CHANGE_WALLET_TYPE","Change wallet type","","","","","","","","","","","","","","","","","","","","","","","","","","","","","",""
"TR_RENEW_SESSION","Renew session","TODO","","","","","","","","","","","","","","","","","","","","","","","","","","","","",""
"TR_CONNECTED","Connected","Device status","","","","","","","","","","","","","","","","","","","","","","","","","","","","",""
"TR_CONNECTED_BOOTLOADER","Connected (bootloader mode)","Device status","","","","","","","","","","","","","","","","","","","","","","","","","","","","",""
"TR_CONNECTED_NOT_INITIALIZED","Connected (not initialized)","Device status","","","","","","","","","","","","","","","","","","","","","","","","","","","","",""
"TR_CONNECTED_SEEDLESS","Connected (seedless mode)","Device status","","","","","","","","","","","","","","","","","","","","","","","","","","","","",""
"TR_CONNECTED_UPDATE_REQUIRED","Connected (update required)","Device status","","","","","","","","","","","","","","","","","","","","","","","","","","","","",""
"TR_CONNECTED_UPDATE_RECOMMENDED","Connected (update recommended)","Device status","","","","","","","","","","","","","","","","","","","","","","","","","","","","",""
"TR_USED_IN_ANOTHER_WINDOW","Used in other window","Device status","","","","","","","","","","","","","","","","","","","","","","","","","","","","",""
"TR_UNAVAILABLE","Unavailable","Device status","","","","","","","","","","","","","","","","","","","","","","","","","","","","",""
"TR_UNREADABLE","Unreadable","Device status","","","","","","","","","","","","","","","","","","","","","","","","","","","","",""
"TR_DISCONNECTED","Disconnected","Device status","","","","","","","","","","","","","","","","","","","","","","","","","","","","",""
"TR_STATUS_UNKNOWN","Status unknown","Device status","","","","","","","","","","","","","","","","","","","","","","","","","","","","",""
"TR_YOU_ARE_IN_YOUR_STANDARD_WALLET","You are in your standard wallet.","","","","","","","","","","","","","","","","","","","","","","","","","","","","","",""
"TR_YOU_ARE_IN_YOUR_WALLET","You are in your hidden wallet.","","","","","","","","","","","","","","","","","","","","","","","","","","","","","",""
"TR_CLICK_HERE_TO_ACCESS_YOUR_HIDDEN","Click here to access your hidden wallet.","","","","","","","","","","","","","","","","","","","","","","","","","","","","","",""
"TR_CLICK_HERE_TO_ACCESS_YOUR_STANDARD","Click here to access your standard or another hidden wallet.","","","","","","","","","","","","","","","","","","","","","","","","","","","","","",""
"TR_TO_ACCESS_OTHER_WALLETS","To access other wallets please connect your device.","","","","","","","","","","","","","","","","","","","","","","","","","","","","","",""
"TR_NEED_HELP","Need help?","","","","","","","","","","","","","","","","","","","","","","","","","","","","","",""
"TR_NUMBER_OF_DEVICES","Number of devices","","","","","","","","","","","","","","","","","","","","","","","","","","","","","",""
"TR_TERMS","Terms","As in Terms and Conditions, In the bottom footer","","","","","","","","","","","","","","","","","","","","","","","","","","","","",""
"TR_EXCHANGE_RATES_BY","Exchange rates by {service}","","","","","","","","","","","","","","","","","","","","","","","","","","","","","",""
"TR_WE_THANK_OUR_TRANSLATORS","We thank our translators for their {TR_CONTRIBUTION}","","","","","","","","","","","","","","","","","","","","","","","","","","","","","",""
"TR_CONTRIBUTION","contribution","Part of the sentence: We thank our translators for their contribution","","","","","","","","","","","","","","","","","","","","","","","","","","","","",""
"TR_TREZOR_WALLET_IS_AN_EASY_DASH","Trezor Wallet is an easy-to-use interface for your Trezor. Trezor Wallet allows you to easily control your funds, manage your balance and initiate transfers.","","","","","","","","","","","","","","","","","","","","","","","","","","","","","",""
"TR_THE_PRIVATE_BANK_IN_YOUR_HANDS","The private bank in your hands.","","","","","","","","","","","","","","","","","","","","","","","","","","","","","",""
"TR_CONNECT_TREZOR_TO_CONTINUE","Connect Trezor to continue","","","","","","","","","","","","","","","","","","","","","","","","","","","","","",""
"TR_AND","and","","","","","","","","","","","","","","","","","","","","","","","","","","","","","",""
"TR_DEVICE_NOT_RECOGNIZED_TRY_INSTALLING","Device not recognized? Try installing the {link}.","","","","","","","","","","","","","","","","","","","","","","","","","","","","","",""
"TR_DONT_HAVE_A_TREZOR_GET","Don't have a Trezor? {getOne}","","","","","","","","","","","","","","","","","","","","","","","","","","","","","",""
"TR_GET_ONE","Get one","Part of the sentence: Dont have a Trezor? Get one","","","","","","","","","","","","","","","","","","","","","","","","","","","","",""
"TR_UNPLUG_DEVICE_LABEL","Unplug ""{deviceLabel}"" device","","","","","","","","","","","","","","","","","","","","","","","","","","","","","",""
"TR_MENU","Menu","Mobile sidebar toggler","","","","","","","","","","","","","","","","","","","","","","","","","","","","",""
"TR_MENU_CLOSE","Close","Used on button for closing sidebar menu","","","","","","","","","","","","","","","","","","","","","","","","","","","","",""
"TR_TREZOR","Trezor","Link in header navigation","","","","","","","","","","","","","","","","","","","","","","","","","","","","",""
"TR_WIKI","Wiki","Link in header navigation","","","","","","","","","","","","","","","","","","","","","","","","","","","","",""
"TR_BLOG","Blog","Link in header navigation","","","","","","","","","","","","","","","","","","","","","","","","","","","","",""
"TR_SUPPORT","Support","Link in header navigation","","","","","","","","","","","","","","","","","","","","","","","","","","","","",""
"TR_ATTENTION_COLON_THE_LOG_CONTAINS","Attention: The log contains your XPUBs. Anyone with your XPUBs can see your account history.","","","","","","","","","","","","","","","","","","","","","","","","","","","","","",""
"TR_LOG","Log","application event and error","","","","","","","","","","","","","","","","","","","","","","","","","","","","",""
"TR_COPY_TO_CLIPBOARD","Copy to clipboard","","","","","","","","","","","","","","","","","","","","","","","","","","","","","",""
"TR_COPIED","Copied!","","","","","","","","","","","","","","","","","","","","","","","","","","","","","",""
"TR_OTHER_COINS","Other coins","","","","","","","","","","","","","","","","","","","","","","","","","","","","","",""
"TR_SELECT_COINS","Select a coin in {TR_SELECT_COINS_LINK}","COMPLETE SENTENCE: Select a coin in application settings","","","","","","","","","","","","","","","","","","","","","","","","","","","","",""
"TR_NAV_TRANSACTIONS","Transactions","Title of the navigation tab that contains tx history.","","","","","","","","","","","","","","","","","","","","","","","","","","","","",""
"TR_NAV_SUMMARY","Summary","Title of the navigation tab that contains information about selected account (balance, tx history).","","","","","","","","","","","","","","","","","","","","","","","","","","","","",""
"TR_NAV_RECEIVE","Receive","Title of the navigation tab that contains the account address","","","","","","","","","","","","","","","","","","","","","","","","","","","","",""
"TR_NAV_SEND","Send","Title of the navigation tab that contains a form for sending funds","","","","","","","","","","","","","","","","","","","","","","","","","","","","",""
"TR_NAV_SIGN_AND_VERIFY","Sign & Verify","Title of the navigation tab that contains a form for signing and verifying messages","","","","","","","","","","","","","","","","","","","","","","","","","","","","",""
"TR_CONTINUE","Continue","Continue button","","","","","","","","","","","","","","","","","","","","","","","","","","","","",""
"TR_BACK","Back","Back button","","","","","","","","","","","","","","","","","","","","","","","","","","","","",""
"TR_SKIP_ALL","Skip onboarding","Button. Skip the entire onboarding process.","","","","","","","","","","","","","","","","","","","","","","","","","","","","",""
"TR_SKIP","Skip","Button. Skip one step","","","","","","","","","","","","","","","","","","","","","","","","","","","","",""
"TR_CONTACT_SUPPORT","Contact support","Button to click to contact support","","","","","","","","","","","","","","","","","","","","","","","","","","","","",""
"TR_RETRY","Retry","Retry button","","","","","","","","","","","","","","","","","","","","","","","","","","","","",""
"TR_CONNECT_YOUR_DEVICE","Connect your device","Prompt to user to connect his device.","","","","","","","","","","","","","","","","","","","","","","","","","","","","",""
"TR_SUBMIT","Submit","Button text","","","","","","","","","","","","","","","","","","","","","","","","","","","","",""
"TR_WIPE_DEVICE","Wipe device","Button","","","","","","","","","","","","","","","","","","","","","","","","","","","","",""
"TR_RESET_DEVICE","Reset device","Button.","","","","","","","","","","","","","","","","","","","","","","","","","","","","",""
"TR_LEARN_MORE_LINK","Learn more.","Link to Trezor wiki.","","","","","","","","","","","","","","","","","","","","","","","","","","","","",""
"TR_BACKUP_INSTRUCTION","Now your device is going to show you 24 words to backup your wallet. Write them down. Do not disconnect your device.","The last instruction before initiating backup process","","","","","","","","","","","","","","","","","","","","","","","","","","","","",""
"TR_BACKUP_OK","Okey.","Button text. Ok, Lets go, or something similar.","","","","","","","","","","","","","","","","","","","","","","","","","","","","",""
"TR_WRITE_DOWN_NTH_WORD","Write down {NthWord} from your device to your recovery seed card.","Ordinal number of word that is currently displayed on Trezor device. For example: Check 1. word.","","","","","","","","","","","","","","","","","","","","","","","","","","","","",""
"TR_CHECK_NTH_WORD","Check {NthWord}","Ordinal number of word that is currently displayed on Trezor device.","","","","","","","","","","","","","","","","","","","","","","","","","","","","",""
"TR_NTH_WORD","{number}. word","Ordinal number. For example: 1. word","","","","","","","","","","","","","","","","","","","","","","","","","","","","",""
"TR_BACKUP_HEADING","Create or recover","Heading in start page","","","","","","","","","","","","","","","","","","","","","","","","","","","","",""
"TR_BACKUP_SUBHEADING_1","Your {TR_SEED_MANUAL_LINK} is the backup key to all your cryptocurrencies and applications.","Explanation what recovery seed is","","","","","","","","","","","","","","","","","","","","","","","","","","","","",""
"TR_SEED_MANUAL_LINK","recovery seed","Link. Part of TR_BACKUP_SUBHEADING_1","","","","","","","","","","","","","","","","","","","","","","","","","","","","",""
"TR_BACKUP_SUBHEADING_2","Your recovery seed can only be displayed once. Never make a digital copy of your recovery seed and never upload it online. Keep your recovery seed in a safe place.","Explanation what recovery seed is","","","","","","","","","","","","","","","","","","","","","","","","","","","","",""
"TR_DO_NOT_UPLOAD_INSTRUCTION","Do not upload words on the internet","Instruction what user should never do with his seed.","","","","","","","","","","","","","","","","","","","","","","","","","","","","",""
"TR_HIDE_TO_SAFE_PLACE_INSTRUCTION","Hide them somewhere safe","Instruction what user should do with his seed.","","","","","","","","","","","","","","","","","","","","","","","","","","","","",""
"TR_DO_NOT_SAFE_IN_COMPUTER_INSTRUCTION","Do not write it into a computer","Instruction what user should never do with his seed.","","","","","","","","","","","","","","","","","","","","","","","","","","","","",""
"TR_DO_NOT_TAKE_PHOTO_INSTRUCTION","Do not take a photo of your recovery seed","Instruction what user should never do with his seed.","","","","","","","","","","","","","","","","","","","","","","","","","","","","",""
"TR_SEED_IS_MORE_IMPORTANT_THAN_YOUR_DEVICE","Seed is more important than your device","Instruction what user should never do with his seed.","","","","","","","","","","","","","","","","","","","","","","","","","","","","",""
"TR_SATOSHILABS_CANNOT_BE_HELD_RESPONSIBLE","SatoshiLabs cannot be held responsible for security liabilities or financial losses resulting from not following security instructions described here.","Liability disclaimer.","","","","","","","","","","","","","","","","","","","","","","","","","","","","",""
"TR_I_HAVE_READ_INSTRUCTIONS","I have read the instructions and agree","Checkbox text","","","","","","","","","","","","","","","","","","","","","","","","","","","","",""
"TR_START_BACKUP","Start backup","Button text","","","","","","","","","","","","","","","","","","","","","","","","","","","","",""
"TR_DEVICE_DISCONNECTED_DURING_ACTION","Device disconnected during action","Error message","","","","","","","","","","","","","","","","","","","","","","","","","","","","",""
"TR_DEVICE_DISCONNECTED_DURING_ACTION_DESCRIPTION","You device disconnected during action which resulted in interuption of backup process. For security reasons you need to wipe your device now and start the backup process again.","Error message. Instruction what to do.","","","","","","","","","","","","","","","","","","","","","","","","","","","","",""
"TR_WIPE_DEVICE_AND_START_AGAIN","Wipe device and start again","Button text","","","","","","","","","","","","","","","","","","","","","","","","","","","","",""
"TR_BACKUP_FINISHED_TEXT","Backup is now on your recovery seed card. Once again dont lose it and keep it private!","Text that appears after backup is finished","","","","","","","","","","","","","","","","","","","","","","","","","","","","",""
"TR_BACKUP_FINISHED_BUTTON","My recovery card is safe","Exit button after backup is finished","","","","","","","","","","","","","","","","","","","","","","","","","","","","",""
"TR_BOOKMARK_HEADING","Browser bookmark","Heading in bookmark step","","","","","","","","","","","","","","","","","","","","","","","","","","","","",""
"TR_BOOKMARK_SUBHEADING","Protect yourself against {TR_PHISHING_ATTACKS}. Bookmark Trezor Wallet (wallet.trezor.io) to avoid visiting fake sites.","Heading in bookmark step","","","","","","","","","","","","","","","","","","","","","","","","","","","","",""
"TR_PHISHING_ATTACKS","phishing attacks","Term, type of hacker attack trying to fool user to enter his sensitive data into a fake site.","","","","","","","","","","","","","","","","","","","","","","","","","","","","",""
"TR_USE_THE_KEYBOARD_SHORTCUT","Use the keyboard shortcut:","We want user to pres Ctrl + D","","","","","","","","","","","","","","","","","","","","","","","","","","","","",""
"TR_BRIDGE_HEADING","Trezor Bridge","Heading on bridge page","","","","","","","","","","","","","","","","","","","","","","","","","","","","",""
"TR_BRIDGE_SUBHEADING","Trezor Bridge is a communication tool to facilitate the connection between your Trezor and your internet browser.","Description what Trezor Bridge is","","","","","","","","","","","","","","","","","","","","","","","","","","","","",""
"TR_DOWNLOAD","Download","Download button","","","","","","","","","","","","","","","","","","","","","","","","","","","","",""
"TR_BRIDGE_IS_RUNNING","Trezor bridge is up and running","Text that indicates that browser can communicate with Trezor Bridge.","","","","","","","","","","","","","","","","","","","","","","","","","","","","",""
"TR_DETECTING_BRIDGE","Detecting Trezor Bridge instalation","Message to show after user clicks download bridge.","","","","","","","","","","","","","","","","","","","","","","","","","","","","",""
"TR_NOT_RUNNING","not running","Bridge status in box next to heading","","","","","","","","","","","","","","","","","","","","","","","","","","","","",""
"TR_WAIT_FOR_FILE_TO_DOWNLOAD","Wait for file to download","Instruction for installing Trezor Bridge","","","","","","","","","","","","","","","","","","","","","","","","","","","","",""
"TR_DOUBLE_CLICK_IT_TO_RUN_INSTALLER","Double click it to run installer","Instruction for installing Trezor Bridge","","","","","","","","","","","","","","","","","","","","","","","","","","","","",""
"TR_TREZOR_BRIDGE_IS_NOT_RUNNING","Trezor Bridge is not running","","","","","","","","","","","","","","","","","","","","","","","","","","","","","",""
"TR_TREZOR_BRIDGE_IS_RUNNING_VERSION","Trezor Bridge is running. Version: {version}","","","","","","","","","","","","","","","","","","","","","","","","","","","","","",""
"TR_DEVICE_IN_BOOTLOADER_MODE","Device in bootloader mode","Indication that device is in bootloader mode","","","","","","","","","","","","","","","","","","","","","","","","","","","","",""
"TR_DEVICE_IN_BOOTLOADER_MODE_INSTRUCTIONS","Device is connected in bootloader mode. Plug out the USB cable and connect device again.","Instructions what to do if device is in bootloader mode","","","","","","","","","","","","","","","","","","","","","","","","","","","","",""
"TR_DEVICE_IS_INITIALIZED","Device is initialized","Indication that device is in already initialized","","","","","","","","","","","","","","","","","","","","","","","","","","","","",""
"TR_DEVICE_LABEL","Device label: {label}.","Display label of device","","","","","","","","","","","","","","","","","","","","","","","","","","","","",""
"TR_DEVICE_FIRMWARE_VERSION","Device firmware: {firmware}.","Display firmware of device","","","","","","","","","","","","","","","","","","","","","","","","","","","","",""
"TR_USER_HAS_WORKDED_WITH_THE_DEVICE","I have worked with it before","Option to click when troubleshooting initialized device.","","","","","","","","","","","","","","","","","","","","","","","","","","","","",""
"TR_USER_HAS_NOT_WORKDED_WITH_THIS_DEVICE","It is a brand new device, just unpacked","Option to click when troubleshooting initialized device.","","","","","","","","","","","","","","","","","","","","","","","","","","","","",""
"TR_INSTRUCTION_TO_SKIP","You should skip setup and continue to wallet and check if you have any funds on this device.","Instruction what to do when user knows the device he is holding was manipulated by him, not someone else.","","","","","","","","","","","","","","","","","","","","","","","","","","","","",""
"TR_USER_HAS_NOT_WORKED_WITH_THIS_DEVICE_INSTRUCTIONS","In that case you should immediately contact Trezor support with detailed information on your purchase and refrain from using this device.","What to do if device is already initialized but not by user.","","","","","","","","","","","","","","","","","","","","","","","","","","","","",""
"TR_SEARCHING_TAKES_TOO_LONG","Searching for your device takes too long, you might want to try to:","Message to display when device is not detected after a decent period of time.","","","","","","","","","","","","","","","","","","","","","","","","","","","","",""
"TR_RECONNECT_INSTRUCTION","Reconnect your device and wait for a while","Troubleshooting instruction","","","","","","","","","","","","","","","","","","","","","","","","","","","","",""
"TR_REFRESH_INSTRUCTION","Refresh your internet browser window","Troubleshooting instruction","","","","","","","","","","","","","","","","","","","","","","","","","","","","",""
"TR_ANOTHER_CABLE_INSTRUCTION","Try using another cable","Troubleshooting instruction","","","","","","","","","","","","","","","","","","","","","","","","","","","","",""
"TR_LAST_RESORT_INSTRUCTION","If nothing helps, {ContactSupportLink}","Troubleshooting instruction. See TR_CONTACT_TREZOR_SUPPORT_LINK","","","","","","","","","","","","","","","","","","","","","","","","","","","","",""
"TR_CONTACT_TREZOR_SUPPORT_LINK","contact Trezor support.","Full sentences: If nothing helps, contact Trezor support. See TR_LAST_RESORT_INSTRUCTION","","","","","","","","","","","","","","","","","","","","","","","","","","","","",""
"TR_CONNECT_HEADING","Time to connect your device","Heading on connect page","","","","","","","","","","","","","","","","","","","","","","","","","","","","",""
"TR_MAKE_SURE_IT_IS_WELL_CONNECTED","Make sure your device is well connected to avoid communication failures.","Instruction for connecting device.","","","","","","","","","","","","","","","","","","","","","","","","","","","","",""
"TR_SEARCHING_FOR_YOUR_DEVICE","Searching for your device","Indication that we app does not see connected device yet.","","","","","","","","","","","","","","","","","","","","","","","","","","","","",""
"TR_DEVICE_DETECTED","Device detected","App can see connected device","","","","","","","","","","","","","","","","","","","","","","","","","","","","",""
"TR_FOUND_OK_DEVICE","Found an empty device, yay! You can continue now.","Case when device was connected and it is in expected state (not initialized)","","","","","","","","","","","","","","","","","","","","","","","","","","","","",""
"TR_FINAL_HEADING","Good job! All done","Heading in newsletter step","","","","","","","","","","","","","","","","","","","","","","","","","","","","",""
"TR_FINAL_SUBHEADING","Now you are ready to enjoy bleeding edge security with Trezor.","Subheading in newsletter step","","","","","","","","","","","","","","","","","","","","","","","","","","","","",""
"TR_TREZOR_STABLE_WALLET","Trezor stable wallet","Name of application that might be used with Trezor","","","","","","","","","","","","","","","","","","","","","","","","","","","","",""
"TR_TREZOR_STABLE_WALLET_DESCRIPTION","Web wallet with support of Bitcoin, Dash, Zcash and other coins.","Description of application that might be used with Trezor.","","","","","","","","","","","","","","","","","","","","","","","","","","","","",""
"TR_TREZOR_PASSWORD_MANAGER","Trezor Password Manager","Name of application that might be used with Trezor","","","","","","","","","","","","","","","","","","","","","","","","","","","","",""
"TR_TREZOR_PASSWORD_MANAGER_DESCRIPTION","A safe way how to manage your credentials with Trezor.","Description of application that might be used with Trezor","","","","","","","","","","","","","","","","","","","","","","","","","","","","",""
"TR_TREZOR_ETHEREUM_WALLET","Ethereum beta wallet","Name of application that might be used with Trezor","","","","","","","","","","","","","","","","","","","","","","","","","","","","",""
"TR_TREZOR_ETHEREUM_WALLET_DESCRIPTION","New wallet with support of Ethereum and Ripple","Description of application that might be used with Trezor","","","","","","","","","","","","","","","","","","","","","","","","","","","","",""
"TR_FIRMWARE_HEADING","Get the latest firmware","Heading on firmware page","","","","","","","","","","","","","","","","","","","","","","","","","","","","",""
